[{"canonical_name":"TierPoint Valley Forge","census_region":"Northeast","county_fips":"42091","county_name":"Montgomery County","evidence_source_ids":["src_kentucky_psc_dbsi_valley_forge_20130430","src_tierpoint_valley_forge_current_2026"],"evidence_status":"sufficient","facility_id":"fac_im3_building_01109881281","generated_at":"2026-09-02T01:30:00Z","initial_tranche_rank":33,"national_priority_id":"lnp_im3_c686eced19d84850baf1","operational_date":{"date":"2013-04-30","precision":"day"},"rationale":"TierPoint's current facility page identifies Valley Forge VFO at 1000 Adams Avenue, matching the mapped building, and offers active colocation, cloud, managed-service, support, and tour functions. A Kentucky Public Service Commission filing received April 30, 2013 identifies DBSi at that exact address as Level One's data center and provider of full operational redundancy, supplying a conservative operational-no-later-than event. Its 137,000-plus-square-foot figure is a lower bound and is retained as context rather than normalized as exact building area.","resolution_confidence":0.99,"resolution_status":"resolved","resolved_current_status":"operational","review_decision_id":"rvw_im3_5076808de45ee8a43a19","review_status":"verified","schema_version":"1.0.0","state_abbr":"PA"},{"canonical_name":"Google","census_region":"Midwest","county_fips":"31153","county_name":"Sarpy County","evidence_source_ids":["src_google_nebraska_current_2026","src_papillion_google_permit_20241119"],"evidence_status":"partial","facility_id":"fac_im3_building_00844394357","generated_at":"2026-09-02T01:30:00Z","initial_tranche_rank":34,"national_priority_id":"lnp_im3_cb78795762784f501fca","rationale":"Google's current Nebraska page establishes active Papillion data-center operation, and Papillion's permit report identifies continuing Google data-center work at 14865 Gold Coast Road. The Papillion campus contains multiple buildings, while neither source identifies the selected footprint or assigns it a building code. Campus evidence therefore cannot establish this building's status.","resolution_status":"unresolved","review_decision_id":"rvw_im3_59b6df5d32adbf412058","review_status":"in_research","schema_version":"1.0.0","state_abbr":"NE"},{"canonical_name":"Evoque Allen DA1","capacity_mw":8.6,"census_region":"South","county_fips":"48085","county_name":"Collin County","evidence_source_ids":["src_csquare_dfw2_specsheet_2025"],"evidence_status":"sufficient","facility_id":"fac_im3_building_00254773897","generated_at":"2026-09-02T01:30:00Z","initial_tranche_rank":35,"national_priority_id":"lnp_im3_19c4bfd7178a5c4a98b6","rationale":"Csquare's current Dallas/Fort Worth specification identifies its unique Allen DFW2 facility at 900 Guardians Way, matching the mapped former Evoque DA1 building, and publishes active services, 24/7 support, an SLA, and 8.6 MW of utility capacity. The 43,366-square-foot figure is explicitly raised-floor space and is not treated as total building area.","resolution_confidence":0.98,"resolution_status":"resolved","resolved_current_status":"operational","review_decision_id":"rvw_im3_2039d68878446684e203","review_status":"verified","schema_version":"1.0.0","state_abbr":"TX"},{"canonical_name":"Serverfarm - LAX1","capacity_mw":17.3,"census_region":"West","county_fips":"06037","county_name":"Los Angeles County","evidence_source_ids":["src_peeringdb_serverfarm_lax1_2025","src_serverfarm_lax1_current_2026"],"evidence_status":"sufficient","facility_id":"fac_im3_building_00424945845","floor_area_sqft":117500,"generated_at":"2026-09-02T01:30:00Z","initial_tranche_rank":36,"national_priority_id":"lnp_im3_de854a102e90c8f9ecb7","rationale":"Serverfarm's current LAX1 page publishes active facility services and exact building-specific capacity and area, while PeeringDB maps LAX1 to 444 North Nash Street and coordinates matching the selected footprint. The 117,500-square-foot building area and 17.3 MW IT capacity are normalized.","resolution_confidence":0.99,"resolution_status":"resolved","resolved_current_status":"operational","review_decision_id":"rvw_im3_f4cc2bee4a8dec74be41","review_status":"verified","schema_version":"1.0.0","state_abbr":"CA"},{"canonical_name":"CyrusOne Norwalk","capacity_mw":4,"census_region":"Northeast","county_fips":"09190","county_name":"Western Connecticut Planning Region","evidence_source_ids":["src_cyrusone_nym5_current_2026","src_cyrusone_nym5_specsheet_2022"],"evidence_status":"sufficient","facility_id":"fac_im3_building_00571010571","floor_area_sqft":168000,"generated_at":"2026-09-02T01:30:00Z","initial_tranche_rank":37,"national_priority_id":"lnp_im3_e0f1fdc7bccd1e5f2374","rationale":"CyrusOne's current page identifies its operating Norwalk facility as NYM5 and publishes current services and 4 MW of IT capacity. Its operator specification maps NYM5 to 6 Norden Place, matching the selected footprint, and reports a 168,000-square-foot facility. Both exact observations are normalized.","resolution_confidence":0.99,"resolution_status":"resolved","resolved_current_status":"operational","review_decision_id":"rvw_im3_b58ad0455f60291f6f7e","review_status":"verified","schema_version":"1.0.0","state_abbr":"CT"},{"canonical_name":"Union Pacific Jack Koraleski Technology, Research & Development Center","census_region":"Midwest","county_fips":"31055","county_name":"Douglas County","evidence_source_ids":["src_dchub_union_pacific_koraleski_2026","src_union_pacific_omaha_current_2026"],"evidence_status":"partial","facility_id":"fac_im3_building_00166431620","generated_at":"2026-09-02T01:30:00Z","initial_tranche_rank":38,"national_priority_id":"lnp_im3_74d19cfd837d509e3965","rationale":"Union Pacific's current Omaha page establishes the railroad's continuing Omaha operations but does not identify the Jack Koraleski Technology, Research & Development Center. A directory maps that name and an operational label to the selected coordinates, but no reviewed operator, assessor, permit, or other official record corroborates the exact building. The directory claim cannot resolve status alone.","resolution_status":"unresolved","review_decision_id":"rvw_im3_61457a6b77838c7a0efa","review_status":"in_research","schema_version":"1.0.0","state_abbr":"NE"},{"canonical_name":"Microsoft Data Center 1","census_region":"South","county_fips":"51153","county_name":"Prince William County","evidence_source_ids":["src_microsoft_virginia_datacenters_202510","src_pwc_data_center_buildings_gis_20260831"],"evidence_status":"conflicting","facility_id":"fac_im3_building_00019787207","generated_at":"2026-09-02T01:30:00Z","initial_tranche_rank":39,"national_priority_id":"lnp_im3_943276d4b6f8faa67ced","rationale":"Microsoft reports Prince William County construction, but the county's live building GIS identifies the selected coordinates as completed Corscale Gainesville Crossing 1 at 13760 University Boulevard, with a finaled permit and 2024 occupancy. The same GIS places Microsoft's MNZ08 at a different nearby point and labels it pending. The exact-coordinate official record therefore conflicts with the seed's Microsoft name and operator, so lifecycle status is disputed pending entity correction.","resolution_status":"disputed","review_decision_id":"rvw_im3_736a1c0f52f64a51594a","review_status":"needs_review","schema_version":"1.0.0","state_abbr":"VA"},{"canonical_name":"Switch12","census_region":"West","county_fips":"32003","county_name":"Clark County","evidence_source_ids":["src_clark_county_switch_operating_permit_20250515","src_switch_las_vegas_12_current_2026"],"evidence_status":"sufficient","facility_id":"fac_im3_building_00172739950","generated_at":"2026-09-02T01:30:00Z","initial_tranche_rank":40,"national_priority_id":"lnp_im3_919cea9a4aff348b5931","rationale":"Switch's current MOD page identifies LAS VEGAS 12 as a completed Core Campus data-center facility, and Clark County's current operating permit independently states that Switch owns and operates NAP 12 among the adjacent Las Vegas facilities. The exact facility number, operator, campus, and selected footprint align.","resolution_confidence":0.99,"resolution_status":"resolved","resolved_current_status":"operational","review_decision_id":"rvw_im3_35d8137efbafedd393dc","review_status":"verified","schema_version":"1.0.0","state_abbr":"NV"}]
