[{"canonical_name":"Equinix New York Secaucus NY4","census_region":"Northeast","county_fips":"34017","county_name":"Hudson County","evidence_source_ids":["src_equinix_ny4_current_2026"],"evidence_status":"sufficient","facility_id":"fac_im3_building_00193611211","generated_at":"2026-09-01T04:00:00Z","initial_tranche_rank":9,"national_priority_id":"lnp_im3_0ee3cec4e338e5086164","rationale":"Equinix's current NY4 page identifies the exact facility code and 755 Secaucus Road address and publishes active products, support, security, power, and cooling specifications. Its 151,771-square-foot figure is explicitly colocation space, so it is retained as context rather than total building area.","resolution_confidence":0.99,"resolution_status":"resolved","resolved_current_status":"operational","review_decision_id":"rvw_im3_4a43545add0871c1427f","review_status":"verified","schema_version":"1.0.0","state_abbr":"NJ"},{"canonical_name":"Amazon Web Services CMH56","census_region":"Midwest","county_fips":"39089","county_name":"Licking County","evidence_source_ids":["src_baxtel_amazon_cmh56_current_2026","src_dcd_aws_new_albany_campus_2023","src_new_albany_project_updates_current_2026"],"evidence_status":"partial","facility_id":"fac_im3_building_01020374278","generated_at":"2026-09-01T04:00:00Z","initial_tranche_rank":10,"national_priority_id":"lnp_im3_e23c273c067fbca81e7f","rationale":"Official New Albany planning records and independent reporting establish active AWS data-center development and operation in the Beech Road area, while a directory labels CMH56 operational. None of the reviewed sources maps the CMH56 code to this exact building with a second accepted identifier, so campus and directory evidence cannot establish the building's lifecycle status.","resolution_status":"unresolved","review_decision_id":"rvw_im3_6848c74f711c0ad8d0e9","review_status":"in_research","schema_version":"1.0.0","state_abbr":"OH"},{"canonical_name":"TierPoint - Charlotte Data Center","census_region":"South","county_fips":"37119","county_name":"Mecklenburg County","evidence_source_ids":["src_tierpoint_charlotte_cl4_current_2026"],"evidence_status":"sufficient","facility_id":"fac_im3_building_00838817907","generated_at":"2026-09-01T04:00:00Z","initial_tranche_rank":11,"national_priority_id":"lnp_im3_8468f0b4bc4a7014b2b1","rationale":"TierPoint's current Charlotte Center Park page identifies CL4 at 1805 Center Park Drive, marks capacity available, and publishes active managed services, remote hands, security, and uptime specifications. The 60,000-plus-square-foot figure is a lower bound and is retained as context rather than normalized as an exact building-area observation.","resolution_confidence":0.99,"resolution_status":"resolved","resolved_current_status":"operational","review_decision_id":"rvw_im3_a4cda86cb37d4b28e87a","review_status":"verified","schema_version":"1.0.0","state_abbr":"NC"},{"canonical_name":"Digital Realty Phoenix PHX15","census_region":"West","county_fips":"04013","county_name":"Maricopa County","evidence_source_ids":["src_digital_realty_phx15_current_2026"],"evidence_status":"sufficient","facility_id":"fac_im3_building_00300952513","floor_area_sqft":508000,"generated_at":"2026-09-01T04:00:00Z","initial_tranche_rank":12,"national_priority_id":"lnp_im3_2d259b486a2edbc6e2a2","rationale":"Digital Realty's current PHX15 page identifies the exact 2121 South Price Road facility and offers active space, compliance, and 24x7 security. Its 508,000-square-foot value is explicitly total building size and is accepted as a facility observation.","resolution_confidence":0.99,"resolution_status":"resolved","resolved_current_status":"operational","review_decision_id":"rvw_im3_65dbdb9eae2b22f32774","review_status":"verified","schema_version":"1.0.0","state_abbr":"AZ"},{"canonical_name":"QTS Piscataway Data Center","census_region":"Northeast","county_fips":"34023","county_name":"Middlesex County","evidence_source_ids":["src_qts_piscataway_1_current_2026","src_qts_piscataway_dc1_datasheet_2024"],"evidence_status":"sufficient","facility_id":"fac_im3_building_00362662493","floor_area_sqft":360000,"generated_at":"2026-09-01T04:00:00Z","initial_tranche_rank":13,"national_priority_id":"lnp_im3_5df1f33773dd644ddc03","rationale":"QTS's current Piscataway 1 page and its DC1 data sheet identify 101 Possumtown Road and publish active facility, tour, security, connectivity, and power information. The data sheet's 360,000-square-foot facility value is accepted; the page's campus and expansion capacity figures are not allocated to the mapped building.","resolution_confidence":0.99,"resolution_status":"resolved","resolved_current_status":"operational","review_decision_id":"rvw_im3_61a07416640a8f8a001e","review_status":"verified","schema_version":"1.0.0","state_abbr":"NJ"},{"canonical_name":"Amazon Web Services  CMH59","census_region":"Midwest","county_fips":"39089","county_name":"Licking County","evidence_source_ids":["src_datacentermap_amazon_cmh59_current_2026","src_dcd_aws_new_albany_campus_2023","src_new_albany_project_updates_current_2026"],"evidence_status":"partial","facility_id":"fac_im3_building_01020374279","generated_at":"2026-09-01T04:00:00Z","initial_tranche_rank":14,"national_priority_id":"lnp_im3_da823dd4deea90ca4f91","rationale":"Official New Albany records and independent reporting establish AWS data-center activity in the Beech Road area, while a directory associates CMH59 with 2560 Beech Road. The reviewed evidence does not independently confirm the CMH59 building-code mapping or current status with a second accepted identifier, so the record remains unresolved.","resolution_status":"unresolved","review_decision_id":"rvw_im3_74b8afa8ca83527d19f5","review_status":"in_research","schema_version":"1.0.0","state_abbr":"OH"},{"canonical_name":"Cyxtera Tampa TP1","capacity_mw":9,"census_region":"South","county_fips":"12057","county_name":"Hillsborough County","evidence_source_ids":["src_csquare_tpa1_specsheet_2026"],"evidence_status":"sufficient","facility_id":"fac_im3_building_00523886201","generated_at":"2026-09-01T04:00:00Z","initial_tranche_rank":15,"national_priority_id":"lnp_im3_e9ae7d224c24ce90fdfd","rationale":"Csquare's current TPA1 specification sheet identifies the exact facility code and 9310 Florida Palm Drive address and publishes active support, security, network, and capacity specifications. Cyxtera remains a historical seed label; the current operator is Csquare.","resolution_confidence":0.98,"resolution_status":"resolved","resolved_current_status":"operational","review_decision_id":"rvw_im3_383b778271ef3bcd958d","review_status":"verified","schema_version":"1.0.0","state_abbr":"FL"},{"canonical_name":"H5 Phoenix","capacity_mw":26,"census_region":"West","county_fips":"04013","county_name":"Maricopa County","evidence_source_ids":["src_h5_phoenix_current_2026"],"evidence_status":"sufficient","facility_id":"fac_im3_building_00300959969","floor_area_sqft":180000,"generated_at":"2026-09-01T04:00:00Z","initial_tranche_rank":16,"national_priority_id":"lnp_im3_bd1d3899d8c87b14a348","rationale":"H5 Data Centers' current Phoenix page identifies the exact 2600 West Germann Road facility, active customer and connectivity services, and a 100% uptime track record. Its 180,000-square-foot facility size and 26 MW capacity are accepted as exact-facility observations.","resolution_confidence":0.99,"resolution_status":"resolved","resolved_current_status":"operational","review_decision_id":"rvw_im3_a88575c4b7ff797ed82f","review_status":"verified","schema_version":"1.0.0","state_abbr":"AZ"}]
